[
  {
    "ticker": "META",
    "datetime": "2025-07-20T09:49:06",
    "open": 402.6,
    "high": 405.01,
    "low": 401.84,
    "close": 402.82,
    "volume": 2697302
  },
  {
    "ticker": "META",
    "datetime": "2025-07-21T09:49:06",
    "open": 401.2,
    "high": 407.78,
    "low": 393.21,
    "close": 403.3,
    "volume": 6703358
  },
  {
    "ticker": "META",
    "datetime": "2025-07-22T09:49:06",
    "open": 416.71,
    "high": 423.55,
    "low": 413.91,
    "close": 414.85,
    "volume": 552211
  },
  {
    "ticker": "META",
    "datetime": "2025-07-23T09:49:06",
    "open": 405.9,
    "high": 415.94,
    "low": 398.8,
    "close": 408.91,
    "volume": 1308027
  },
  {
    "ticker": "META",
    "datetime": "2025-07-24T09:49:06",
    "open": 407.65,
    "high": 411.01,
    "low": 402.2,
    "close": 405.53,
    "volume": 9154951
  },
  {
    "ticker": "META",
    "datetime": "2025-07-25T09:49:06",
    "open": 404.65,
    "high": 409.57,
    "low": 403.11,
    "close": 405.32,
    "volume": 2934117
  },
  {
    "ticker": "META",
    "datetime": "2025-07-26T09:49:06",
    "open": 423.69,
    "high": 430.86,
    "low": 414.34,
    "close": 422.5,
    "volume": 2393895
  }
]