[
  {
    "ticker": "SOLUSD",
    "datetime": "2025-06-27T09:49:06",
    "open": 288.18,
    "high": 292.86,
    "low": 287.23,
    "close": 288.35,
    "volume": 1223067
  },
  {
    "ticker": "SOLUSD",
    "datetime": "2025-06-28T09:49:06",
    "open": 286.68,
    "high": 292.49,
    "low": 284.47,
    "close": 289.01,
    "volume": 5248441
  },
  {
    "ticker": "SOLUSD",
    "datetime": "2025-06-29T09:49:06",
    "open": 274.33,
    "high": 279.91,
    "low": 274.03,
    "close": 274.49,
    "volume": 8765508
  },
  {
    "ticker": "SOLUSD",
    "datetime": "2025-06-30T09:49:06",
    "open": 272.45,
    "high": 279.99,
    "low": 270.36,
    "close": 274.68,
    "volume": 1821253
  },
  {
    "ticker": "SOLUSD",
    "datetime": "2025-07-01T09:49:06",
    "open": 280.75,
    "high": 282.45,
    "low": 276.71,
    "close": 279.19,
    "volume": 4025827
  },
  {
    "ticker": "SOLUSD",
    "datetime": "2025-07-02T09:49:06",
    "open": 291.99,
    "high": 296.47,
    "low": 288.22,
    "close": 293.27,
    "volume": 8523997
  },
  {
    "ticker": "SOLUSD",
    "datetime": "2025-07-03T09:49:06",
    "open": 297.52,
    "high": 300.88,
    "low": 297.05,
    "close": 298.47,
    "volume": 1179535
  },
  {
    "ticker": "SOLUSD",
    "datetime": "2025-07-04T09:49:06",
    "open": 308.7,
    "high": 310.95,
    "low": 303.05,
    "close": 307.92,
    "volume": 5040078
  },
  {
    "ticker": "SOLUSD",
    "datetime": "2025-07-05T09:49:06",
    "open": 306.36,
    "high": 308.11,
    "low": 300.79,
    "close": 306.95,
    "volume": 8504527
  },
  {
    "ticker": "SOLUSD",
    "datetime": "2025-07-06T09:49:06",
    "open": 308.65,
    "high": 313.2,
    "low": 304.3,
    "close": 309.8,
    "volume": 7896097
  },
  {
    "ticker": "SOLUSD",
    "datetime": "2025-07-07T09:49:06",
    "open": 308.04,
    "high": 313.97,
    "low": 301.59,
    "close": 307.49,
    "volume": 8257526
  },
  {
    "ticker": "SOLUSD",
    "datetime": "2025-07-08T09:49:06",
    "open": 310.09,
    "high": 315.76,
    "low": 309.94,
    "close": 312.37,
    "volume": 1332137
  },
  {
    "ticker": "SOLUSD",
    "datetime": "2025-07-09T09:49:06",
    "open": 304.56,
    "high": 308.72,
    "low": 303.48,
    "close": 306.07,
    "volume": 9928173
  },
  {
    "ticker": "SOLUSD",
    "datetime": "2025-07-10T09:49:06",
    "open": 307.44,
    "high": 312.82,
    "low": 301.66,
    "close": 306.32,
    "volume": 1419844
  },
  {
    "ticker": "SOLUSD",
    "datetime": "2025-07-11T09:49:06",
    "open": 301.67,
    "high": 305.07,
    "low": 298.38,
    "close": 301.79,
    "volume": 4079955
  },
  {
    "ticker": "SOLUSD",
    "datetime": "2025-07-12T09:49:06",
    "open": 289.81,
    "high": 292.76,
    "low": 287.26,
    "close": 289.82,
    "volume": 7031576
  },
  {
    "ticker": "SOLUSD",
    "datetime": "2025-07-13T09:49:06",
    "open": 287.37,
    "high": 291.38,
    "low": 282.9,
    "close": 288.2,
    "volume": 6374121
  },
  {
    "ticker": "SOLUSD",
    "datetime": "2025-07-14T09:49:06",
    "open": 294.62,
    "high": 296.03,
    "low": 290.8,
    "close": 295.34,
    "volume": 6337825
  },
  {
    "ticker": "SOLUSD",
    "datetime": "2025-07-15T09:49:06",
    "open": 288.85,
    "high": 292.71,
    "low": 283.57,
    "close": 290.16,
    "volume": 5368625
  },
  {
    "ticker": "SOLUSD",
    "datetime": "2025-07-16T09:49:06",
    "open": 302.16,
    "high": 304.71,
    "low": 299.99,
    "close": 301.65,
    "volume": 7465282
  },
  {
    "ticker": "SOLUSD",
    "datetime": "2025-07-17T09:49:06",
    "open": 289.63,
    "high": 295.12,
    "low": 285.92,
    "close": 288.82,
    "volume": 9784303
  },
  {
    "ticker": "SOLUSD",
    "datetime": "2025-07-18T09:49:06",
    "open": 301.42,
    "high": 305.5,
    "low": 295.8,
    "close": 302.55,
    "volume": 4631848
  },
  {
    "ticker": "SOLUSD",
    "datetime": "2025-07-19T09:49:06",
    "open": 298.83,
    "high": 303.57,
    "low": 297.54,
    "close": 301.5,
    "volume": 7937582
  },
  {
    "ticker": "SOLUSD",
    "datetime": "2025-07-20T09:49:06",
    "open": 286.58,
    "high": 288.07,
    "low": 281.05,
    "close": 287.39,
    "volume": 3581645
  },
  {
    "ticker": "SOLUSD",
    "datetime": "2025-07-21T09:49:06",
    "open": 286.52,
    "high": 289.21,
    "low": 283.78,
    "close": 287.22,
    "volume": 4462516
  },
  {
    "ticker": "SOLUSD",
    "datetime": "2025-07-22T09:49:06",
    "open": 277.71,
    "high": 282.6,
    "low": 275.94,
    "close": 280.03,
    "volume": 3786409
  },
  {
    "ticker": "SOLUSD",
    "datetime": "2025-07-23T09:49:06",
    "open": 277.12,
    "high": 279.61,
    "low": 270.39,
    "close": 275.84,
    "volume": 8297533
  },
  {
    "ticker": "SOLUSD",
    "datetime": "2025-07-24T09:49:06",
    "open": 278.87,
    "high": 281.16,
    "low": 274.11,
    "close": 278.54,
    "volume": 9085840
  },
  {
    "ticker": "SOLUSD",
    "datetime": "2025-07-25T09:49:06",
    "open": 266.92,
    "high": 272.3,
    "low": 264.83,
    "close": 267.63,
    "volume": 5389021
  },
  {
    "ticker": "SOLUSD",
    "datetime": "2025-07-26T09:49:06",
    "open": 273.68,
    "high": 278.18,
    "low": 270.69,
    "close": 272.46,
    "volume": 8733833
  }
]