[
  {
    "ticker": "RIO",
    "datetime": "2025-07-20T09:49:06",
    "open": 72.77,
    "high": 74.2,
    "low": 72.57,
    "close": 72.77,
    "volume": 4802754
  },
  {
    "ticker": "RIO",
    "datetime": "2025-07-21T09:49:06",
    "open": 69.87,
    "high": 70.12,
    "low": 69.0,
    "close": 70.11,
    "volume": 3323744
  },
  {
    "ticker": "RIO",
    "datetime": "2025-07-22T09:49:06",
    "open": 68.85,
    "high": 69.75,
    "low": 67.67,
    "close": 68.95,
    "volume": 1289273
  },
  {
    "ticker": "RIO",
    "datetime": "2025-07-23T09:49:06",
    "open": 72.27,
    "high": 73.26,
    "low": 70.98,
    "close": 72.08,
    "volume": 8835177
  },
  {
    "ticker": "RIO",
    "datetime": "2025-07-24T09:49:06",
    "open": 73.5,
    "high": 73.51,
    "low": 72.83,
    "close": 73.36,
    "volume": 6140808
  },
  {
    "ticker": "RIO",
    "datetime": "2025-07-25T09:49:06",
    "open": 73.61,
    "high": 74.12,
    "low": 72.94,
    "close": 73.07,
    "volume": 628669
  },
  {
    "ticker": "RIO",
    "datetime": "2025-07-26T09:49:06",
    "open": 75.48,
    "high": 76.84,
    "low": 75.25,
    "close": 76.0,
    "volume": 2862579
  }
]