[
  {
    "ticker": "JPM",
    "datetime": "2025-06-27T09:49:06",
    "open": 135.52,
    "high": 137.39,
    "low": 134.41,
    "close": 135.2,
    "volume": 7806375
  },
  {
    "ticker": "JPM",
    "datetime": "2025-06-28T09:49:06",
    "open": 141.1,
    "high": 142.04,
    "low": 140.32,
    "close": 141.15,
    "volume": 4025645
  },
  {
    "ticker": "JPM",
    "datetime": "2025-06-29T09:49:06",
    "open": 134.37,
    "high": 135.19,
    "low": 133.84,
    "close": 134.22,
    "volume": 9381398
  },
  {
    "ticker": "JPM",
    "datetime": "2025-06-30T09:49:06",
    "open": 131.62,
    "high": 132.83,
    "low": 130.39,
    "close": 132.51,
    "volume": 8067263
  },
  {
    "ticker": "JPM",
    "datetime": "2025-07-01T09:49:06",
    "open": 130.32,
    "high": 130.66,
    "low": 129.73,
    "close": 130.17,
    "volume": 9587395
  },
  {
    "ticker": "JPM",
    "datetime": "2025-07-02T09:49:06",
    "open": 130.06,
    "high": 130.95,
    "low": 126.74,
    "close": 129.19,
    "volume": 8500928
  },
  {
    "ticker": "JPM",
    "datetime": "2025-07-03T09:49:06",
    "open": 134.64,
    "high": 138.16,
    "low": 133.59,
    "close": 135.5,
    "volume": 5016288
  },
  {
    "ticker": "JPM",
    "datetime": "2025-07-04T09:49:06",
    "open": 138.44,
    "high": 140.44,
    "low": 136.09,
    "close": 138.08,
    "volume": 7198012
  },
  {
    "ticker": "JPM",
    "datetime": "2025-07-05T09:49:06",
    "open": 139.31,
    "high": 139.5,
    "low": 138.7,
    "close": 139.3,
    "volume": 6317577
  },
  {
    "ticker": "JPM",
    "datetime": "2025-07-06T09:49:06",
    "open": 142.28,
    "high": 143.21,
    "low": 140.95,
    "close": 142.61,
    "volume": 2258405
  },
  {
    "ticker": "JPM",
    "datetime": "2025-07-07T09:49:06",
    "open": 149.74,
    "high": 151.07,
    "low": 147.31,
    "close": 148.51,
    "volume": 8896861
  },
  {
    "ticker": "JPM",
    "datetime": "2025-07-08T09:49:06",
    "open": 155.92,
    "high": 158.07,
    "low": 152.79,
    "close": 155.77,
    "volume": 6396971
  },
  {
    "ticker": "JPM",
    "datetime": "2025-07-09T09:49:06",
    "open": 152.79,
    "high": 153.76,
    "low": 151.56,
    "close": 152.01,
    "volume": 6282259
  },
  {
    "ticker": "JPM",
    "datetime": "2025-07-10T09:49:06",
    "open": 148.56,
    "high": 150.73,
    "low": 147.44,
    "close": 148.64,
    "volume": 3309762
  },
  {
    "ticker": "JPM",
    "datetime": "2025-07-11T09:49:06",
    "open": 150.14,
    "high": 152.35,
    "low": 148.01,
    "close": 149.33,
    "volume": 3264113
  },
  {
    "ticker": "JPM",
    "datetime": "2025-07-12T09:49:06",
    "open": 147.75,
    "high": 148.14,
    "low": 147.41,
    "close": 147.53,
    "volume": 2591627
  },
  {
    "ticker": "JPM",
    "datetime": "2025-07-13T09:49:06",
    "open": 150.46,
    "high": 151.7,
    "low": 147.73,
    "close": 150.21,
    "volume": 2887017
  },
  {
    "ticker": "JPM",
    "datetime": "2025-07-14T09:49:06",
    "open": 146.91,
    "high": 149.42,
    "low": 144.58,
    "close": 147.36,
    "volume": 3707585
  },
  {
    "ticker": "JPM",
    "datetime": "2025-07-15T09:49:06",
    "open": 148.51,
    "high": 150.79,
    "low": 148.48,
    "close": 149.57,
    "volume": 5729903
  },
  {
    "ticker": "JPM",
    "datetime": "2025-07-16T09:49:06",
    "open": 152.95,
    "high": 153.78,
    "low": 150.65,
    "close": 153.6,
    "volume": 1122507
  },
  {
    "ticker": "JPM",
    "datetime": "2025-07-17T09:49:06",
    "open": 154.83,
    "high": 156.84,
    "low": 152.42,
    "close": 155.37,
    "volume": 3404326
  },
  {
    "ticker": "JPM",
    "datetime": "2025-07-18T09:49:06",
    "open": 151.06,
    "high": 152.75,
    "low": 149.54,
    "close": 151.96,
    "volume": 9051550
  },
  {
    "ticker": "JPM",
    "datetime": "2025-07-19T09:49:06",
    "open": 154.78,
    "high": 155.89,
    "low": 153.41,
    "close": 154.44,
    "volume": 9645436
  },
  {
    "ticker": "JPM",
    "datetime": "2025-07-20T09:49:06",
    "open": 159.92,
    "high": 161.95,
    "low": 157.56,
    "close": 159.81,
    "volume": 5057946
  },
  {
    "ticker": "JPM",
    "datetime": "2025-07-21T09:49:06",
    "open": 154.81,
    "high": 157.93,
    "low": 154.12,
    "close": 155.05,
    "volume": 2341416
  },
  {
    "ticker": "JPM",
    "datetime": "2025-07-22T09:49:06",
    "open": 152.03,
    "high": 153.69,
    "low": 151.04,
    "close": 153.07,
    "volume": 2077477
  },
  {
    "ticker": "JPM",
    "datetime": "2025-07-23T09:49:06",
    "open": 155.43,
    "high": 157.14,
    "low": 154.66,
    "close": 155.41,
    "volume": 724301
  },
  {
    "ticker": "JPM",
    "datetime": "2025-07-24T09:49:06",
    "open": 161.31,
    "high": 163.1,
    "low": 159.1,
    "close": 161.36,
    "volume": 6072919
  },
  {
    "ticker": "JPM",
    "datetime": "2025-07-25T09:49:06",
    "open": 152.94,
    "high": 155.33,
    "low": 151.56,
    "close": 152.71,
    "volume": 5793050
  },
  {
    "ticker": "JPM",
    "datetime": "2025-07-26T09:49:06",
    "open": 160.33,
    "high": 162.88,
    "low": 157.2,
    "close": 159.24,
    "volume": 2083410
  }
]