[
  {
    "ticker": "V",
    "datetime": "2025-07-20T09:49:06",
    "open": 132.76,
    "high": 133.83,
    "low": 131.98,
    "close": 132.23,
    "volume": 7133693
  },
  {
    "ticker": "V",
    "datetime": "2025-07-21T09:49:06",
    "open": 131.08,
    "high": 131.58,
    "low": 128.41,
    "close": 130.5,
    "volume": 9135974
  },
  {
    "ticker": "V",
    "datetime": "2025-07-22T09:49:06",
    "open": 131.43,
    "high": 133.42,
    "low": 129.52,
    "close": 131.61,
    "volume": 3808961
  },
  {
    "ticker": "V",
    "datetime": "2025-07-23T09:49:06",
    "open": 133.42,
    "high": 133.45,
    "low": 132.36,
    "close": 133.23,
    "volume": 5880685
  },
  {
    "ticker": "V",
    "datetime": "2025-07-24T09:49:06",
    "open": 136.15,
    "high": 136.24,
    "low": 134.17,
    "close": 135.46,
    "volume": 8290064
  },
  {
    "ticker": "V",
    "datetime": "2025-07-25T09:49:06",
    "open": 135.75,
    "high": 137.78,
    "low": 133.94,
    "close": 136.34,
    "volume": 5481087
  },
  {
    "ticker": "V",
    "datetime": "2025-07-26T09:49:06",
    "open": 130.39,
    "high": 130.77,
    "low": 127.41,
    "close": 129.98,
    "volume": 289085
  }
]