[
  {
    "ticker": "GOOGL",
    "datetime": "2025-06-27T09:49:06",
    "open": 356.37,
    "high": 358.19,
    "low": 351.31,
    "close": 357.23,
    "volume": 6180082
  },
  {
    "ticker": "GOOGL",
    "datetime": "2025-06-28T09:49:06",
    "open": 340.54,
    "high": 347.7,
    "low": 339.9,
    "close": 343.24,
    "volume": 5891045
  },
  {
    "ticker": "GOOGL",
    "datetime": "2025-06-29T09:49:06",
    "open": 335.36,
    "high": 343.21,
    "low": 331.47,
    "close": 338.1,
    "volume": 3202937
  },
  {
    "ticker": "GOOGL",
    "datetime": "2025-06-30T09:49:06",
    "open": 346.29,
    "high": 354.52,
    "low": 342.31,
    "close": 348.21,
    "volume": 2748137
  },
  {
    "ticker": "GOOGL",
    "datetime": "2025-07-01T09:49:06",
    "open": 355.87,
    "high": 356.51,
    "low": 351.31,
    "close": 354.74,
    "volume": 3412134
  },
  {
    "ticker": "GOOGL",
    "datetime": "2025-07-02T09:49:06",
    "open": 367.32,
    "high": 368.68,
    "low": 359.44,
    "close": 364.55,
    "volume": 3975144
  },
  {
    "ticker": "GOOGL",
    "datetime": "2025-07-03T09:49:06",
    "open": 371.61,
    "high": 374.51,
    "low": 370.68,
    "close": 371.25,
    "volume": 4539974
  },
  {
    "ticker": "GOOGL",
    "datetime": "2025-07-04T09:49:06",
    "open": 384.88,
    "high": 386.17,
    "low": 382.15,
    "close": 384.27,
    "volume": 1711035
  },
  {
    "ticker": "GOOGL",
    "datetime": "2025-07-05T09:49:06",
    "open": 392.49,
    "high": 392.88,
    "low": 387.77,
    "close": 390.36,
    "volume": 6519662
  },
  {
    "ticker": "GOOGL",
    "datetime": "2025-07-06T09:49:06",
    "open": 398.98,
    "high": 402.26,
    "low": 395.2,
    "close": 397.0,
    "volume": 1500227
  },
  {
    "ticker": "GOOGL",
    "datetime": "2025-07-07T09:49:06",
    "open": 415.59,
    "high": 419.38,
    "low": 408.55,
    "close": 413.9,
    "volume": 5110975
  },
  {
    "ticker": "GOOGL",
    "datetime": "2025-07-08T09:49:06",
    "open": 428.03,
    "high": 435.94,
    "low": 422.77,
    "close": 430.3,
    "volume": 6555988
  },
  {
    "ticker": "GOOGL",
    "datetime": "2025-07-09T09:49:06",
    "open": 412.6,
    "high": 415.38,
    "low": 404.63,
    "close": 412.1,
    "volume": 841598
  },
  {
    "ticker": "GOOGL",
    "datetime": "2025-07-10T09:49:06",
    "open": 431.16,
    "high": 438.49,
    "low": 426.36,
    "close": 429.5,
    "volume": 2955789
  },
  {
    "ticker": "GOOGL",
    "datetime": "2025-07-11T09:49:06",
    "open": 449.65,
    "high": 451.6,
    "low": 443.4,
    "close": 449.04,
    "volume": 4372880
  },
  {
    "ticker": "GOOGL",
    "datetime": "2025-07-12T09:49:06",
    "open": 446.46,
    "high": 446.77,
    "low": 444.72,
    "close": 444.95,
    "volume": 2431422
  },
  {
    "ticker": "GOOGL",
    "datetime": "2025-07-13T09:49:06",
    "open": 457.43,
    "high": 460.81,
    "low": 455.22,
    "close": 460.4,
    "volume": 1679079
  },
  {
    "ticker": "GOOGL",
    "datetime": "2025-07-14T09:49:06",
    "open": 459.8,
    "high": 462.13,
    "low": 457.74,
    "close": 461.76,
    "volume": 5521127
  },
  {
    "ticker": "GOOGL",
    "datetime": "2025-07-15T09:49:06",
    "open": 467.16,
    "high": 467.65,
    "low": 461.02,
    "close": 466.62,
    "volume": 228386
  },
  {
    "ticker": "GOOGL",
    "datetime": "2025-07-16T09:49:06",
    "open": 481.11,
    "high": 485.39,
    "low": 475.55,
    "close": 481.95,
    "volume": 1039099
  },
  {
    "ticker": "GOOGL",
    "datetime": "2025-07-17T09:49:06",
    "open": 469.72,
    "high": 474.13,
    "low": 467.79,
    "close": 470.29,
    "volume": 4846324
  },
  {
    "ticker": "GOOGL",
    "datetime": "2025-07-18T09:49:06",
    "open": 455.49,
    "high": 457.92,
    "low": 453.03,
    "close": 455.11,
    "volume": 2619960
  },
  {
    "ticker": "GOOGL",
    "datetime": "2025-07-19T09:49:06",
    "open": 478.99,
    "high": 486.45,
    "low": 472.5,
    "close": 478.0,
    "volume": 5564203
  },
  {
    "ticker": "GOOGL",
    "datetime": "2025-07-20T09:49:06",
    "open": 459.59,
    "high": 465.2,
    "low": 458.46,
    "close": 461.95,
    "volume": 4218396
  },
  {
    "ticker": "GOOGL",
    "datetime": "2025-07-21T09:49:06",
    "open": 452.73,
    "high": 461.13,
    "low": 450.63,
    "close": 451.14,
    "volume": 5790819
  },
  {
    "ticker": "GOOGL",
    "datetime": "2025-07-22T09:49:06",
    "open": 428.47,
    "high": 434.25,
    "low": 427.41,
    "close": 430.01,
    "volume": 1578707
  },
  {
    "ticker": "GOOGL",
    "datetime": "2025-07-23T09:49:06",
    "open": 408.95,
    "high": 414.51,
    "low": 401.88,
    "close": 407.32,
    "volume": 1185354
  },
  {
    "ticker": "GOOGL",
    "datetime": "2025-07-24T09:49:06",
    "open": 415.62,
    "high": 416.57,
    "low": 407.75,
    "close": 415.33,
    "volume": 1237350
  },
  {
    "ticker": "GOOGL",
    "datetime": "2025-07-25T09:49:06",
    "open": 430.04,
    "high": 430.8,
    "low": 427.02,
    "close": 428.48,
    "volume": 4030971
  },
  {
    "ticker": "GOOGL",
    "datetime": "2025-07-26T09:49:06",
    "open": 420.83,
    "high": 427.75,
    "low": 414.73,
    "close": 420.73,
    "volume": 2231138
  }
]