[
  {
    "ticker": "NVDA",
    "datetime": "2025-07-20T09:49:06",
    "open": 319.52,
    "high": 320.61,
    "low": 316.68,
    "close": 317.83,
    "volume": 5509530
  },
  {
    "ticker": "NVDA",
    "datetime": "2025-07-21T09:49:06",
    "open": 323.05,
    "high": 323.2,
    "low": 320.74,
    "close": 321.43,
    "volume": 766460
  },
  {
    "ticker": "NVDA",
    "datetime": "2025-07-22T09:49:06",
    "open": 328.0,
    "high": 328.62,
    "low": 324.92,
    "close": 326.47,
    "volume": 4500840
  },
  {
    "ticker": "NVDA",
    "datetime": "2025-07-23T09:49:06",
    "open": 326.16,
    "high": 329.13,
    "low": 319.3,
    "close": 325.02,
    "volume": 1087661
  },
  {
    "ticker": "NVDA",
    "datetime": "2025-07-24T09:49:06",
    "open": 322.53,
    "high": 323.98,
    "low": 316.59,
    "close": 322.85,
    "volume": 9771164
  },
  {
    "ticker": "NVDA",
    "datetime": "2025-07-25T09:49:06",
    "open": 323.92,
    "high": 330.07,
    "low": 317.57,
    "close": 325.39,
    "volume": 9225312
  },
  {
    "ticker": "NVDA",
    "datetime": "2025-07-26T09:49:06",
    "open": 322.75,
    "high": 328.36,
    "low": 321.83,
    "close": 321.89,
    "volume": 3175438
  }
]